{
  "filename": "police-emmental.pdf",
  "company": "Emmental",
  "policyNumber": "pour",
  "policyType": null,
  "insuredPerson": null,
  "address": "2950 Courgenay",
  "annualPremium": null,
  "startDate": "01.05.2024",
  "endDate": "30.04.2028",
  "franchise": null,
  "coverageType": "Vehicle",
  "rawText": "\n\n--- PAGE 1 ---\n\nemmental\nversicherung\nPolice pour solution d'assurance\nVéhicules\nVotre Conseiller\nWW Finance Group\nBellevue 7\n2950 Courgenay\n032 466 11 00\nPreneur d'assurance: Marie Chavanne, le Breuil 1, 2950 Courgenay\nDonnées du contrat\nPolice N°\n50128660\nWW Finance Group\nBellevue 7\n2950 Courgenay\nDébut\nEchéance\n01.05.2024\n30.04.2028\nEchéance de la prime\nMode de paiement\n1 mai\nsemestriel\nPlaque de contrôle\nJU 6478\nVéhicule/s\nYAMAHA MT-03 ABS\nAperçu des primes\nResponsabilité civile automobile\nCasco\nDépannage\nPrime annuelle\nTaxes légales*\nPrime annuelle total\nPrime annuelle en CHF\n*Taxes légales: Droit de timbre fédéral 5% pour toutes les prestations d'assurance convenues, hors accident;\nContribution à la prévention des accidents 0.75 % et cotisations selon la loi sur la circulation routière (CHF 2.10/\nCHF 4.20 / CHF 8.40 selon la catégorie de véhicule) pour responsabilité civile.\n245.90\n385.10\n85.00\n716.00\n39.70\n755.70\nLes réductions, et en particulier une éventuelle remise pour plaques interchangeables sont déjà prises\nen compte dans les primes.\n09.04.2024\nPolice N°: 50128660\nemmental versicherung Genossenschaft | Emmentalstrasse 23 | 3510 Konolfingen\nT 031 790 31 11 | info@emmental-versicherung.ch | emmental-versicherung.ch\nPage 1/6\n\n--- PAGE 2 ---\n\nAperçu des prestations\nYAMAHA MT-03 ABS\nPrestations d'assurance\nSomme d'assurance\nFranchise\nen CHF\nen CHF\nResponsabilité civile automobile\n100'000'000\nConducteurs à partir du 25e anniversaire\nConducteurs avant le 25e anniversaire\nCouverture pour faute grave\nCasco\nCasco partielle\nIncendie/Forces de la\nnature/Animaux/Fouines/Vol/Bris de glaces\nDommages aux véhicules parqués\nCollision premier risque\nCouverture pour faute grave\nSous-total\nAccidents occupants\nDépannage\nEuropa avec véhicule de remplacement\nProtection juridique\nPrime annuelle\n09.04.2024\nPolice N°: 50128660\n0\n1'000\nPrime\nen CHF\n245.90\nsans surtaxe\n0\n57.90\n0\n10'000\n500\nemmental versicherung Genossenschaft | Emmentalstrasse 23 | 3510 Konolfingen\nT 031 790 31 11 | info@emmental-versicherung.ch | emmental-versicherung.ch\n80.70\n246.50\nsans surtaxe\n385.10\npas assuré\n85.00\npas assuré\n716.00\nPage 2/6\n\n--- PAGE 3 ---\n\nRenseignements sur le véhicule et la personne\nYAMAHA MT-03 ABS\nRenseignements sur le véhicule\nGenre de véhicule\nPlaque de contrôle\nType de plaque\nMarque\nType\n1re mise en circulation\nNo matricule\nNo de châssis\nCylindrée (ccm)\nCV-DIN\nMotocyclette\nJU 6478\nPlaque individuelle\nYAMAHA\nMT-03 ABS\n04.04.2023\n669.785.586\n321\n42\nPlaces\n2\nPoids à vide (kg)\n243\nPoids total (kg)\n328\nType de carburant\nUtilisation\nPrix catalogue (CHF)\nAccessoires (CHF)\nEssence sans Plomb\nPrivé et chemin de travail\n6'590\n659\nConducteur principal\nNom, prénom:\nRue, n°:\nNPA, Lieu:\nDate de naissance:\nNationalité:\nChavanne Marie\n2950 Courgenay\nle Breuil 1\n01.10.2004\nSuisse\nPour les conducteurs de 25 ans ou moins, la prime annuelle pour la responsabilité civile et le risque de\ncollision (à l'exception de la collision premier risque) baisse à l'échéance.\n09.04.2024\nPolice N°: 50128660\nemmental versicherung Genossenschaft | Emmentalstrasse 23 | 3510 Konolfingen\nT 031 790 31 11 | info@emmental-versicherung.ch | emmental-versicherung.ch\nPage 3/6\n\n--- PAGE 4 ---\n\nQuestions de la proposition\nYAMAHA MT-03 ABS\nLes questions suivantes concernent le conducteur le plus fréquent au cours des 3 dernières années:\nAvez-vous déjà eu de dommages en responsabilité civile? Combien?\n0\nAvez-vous déjà eu de dommages par collision? Combien?\n0\nAvez-vous déjà eu de dommages par vol de véhicule? Combien perte totale?\n0\nUne compagnie d'assurances vous a-t-elle refusé une demande d'assurance véhicules à moteur,\nrésilié un contrat ou subordonné une continuation à des conditions aggravantes?\nNon\nAvez-vous eu des retraits de permis d'une durée de trois mois ou plus pour abus d'alcool, de drogues\nou de médicaments?\nNon\nAvez-vous eu des retraits de permis d'une durée de trois mois ou plus pour délits d'excès de vitesse?\nNon\nAvez-vous eu des retraits de permis d'une durée de trois mois ou plus pour autres motifs?\nNon\n09.04.2024\nPolice N°: 50128660\nemmental versicherung Genossenschaft | Emmentalstrasse 23 | 3510 Konolfingen\nT 031 790 31 11 | info@emmental-versicherung.ch | emmental-versicherung.ch\nPage 4/6\n\n--- PAGE 5 ---\n\nTermes du contrat\nBases contractuelles\nCGA Responsabilité civile pour véhicule à moteur 2022\nCGA Casco 2022\nCGA Dépannage 2022\nInformation clients véhicules à moteur 2022\n09.04.2024\nPolice N°: 50128660\nemmental versicherung Genossenschaft | Emmentalstrasse 23 | 3510 Konolfingen\nT 031 790 31 11 | info@emmental-versicherung.ch | emmental-versicherung.ch\nPage 5/6\n\n--- PAGE 6 ---\n\nDéclaration finale\nCher coopérateur, chère coopératrice, veuillez tenir compte de:\nLes questions concernant la proposition font partie intégrante de la police.\nOrion Assurance de Protection Juridique SA est l'assureur de la partie protection juridique. Vous pouvez\ndéclarer les cas de sinistre directement auprès d'Orion. Orion traite directement les cas de sinistre avec\nvous.\nAu cours de l'assurance, si un fait déterminant change, ou s'il y a un changement du risque conséquent,\nvous devez le communiquer à emmental assurance sans délai par écrit ou sous une autre forme qui\npermet le suivi par texte (p.ex. par e-mail). En cas d'augmentation du risque, emmental assurance\nexamine le contrat pour l'adapter aux changements de conditions.\nKonolfingen, 09.04.2024\nemmental versicherung\nAndreas Stucki\nRonaldo Schiavoni\n09.04.2024\nPolice N°: 50128660\nemmental versicherung Genossenschaft | Emmentalstrasse 23 | 3510 Konolfingen\nT 031 790 31 11 | info@emmental-versicherung.ch | emmental-versicherung.ch\nPage 6/6"
}