{
  "filename": "police-swisslife.pdf",
  "company": "Swiss Life",
  "policyNumber": "n",
  "policyType": null,
  "insuredPerson": "Bernadette Rondez",
  "address": "2900 Porrentruy",
  "annualPremium": null,
  "startDate": "5.3.2019",
  "endDate": "5.3.2019",
  "franchise": null,
  "coverageType": "LCA",
  "rawText": "\n\n--- PAGE 1 ---\n\n2739180-F\nSwiss Life\nMadame\nBernadette Rondez\nc/o WW Finance Group Sàrl\nCase postale 6\n2900 Porrentruy 2\nSwiss Life SA\nClientèle privée\nGeneral-Guisan-Quai 40\nCase postale, 8022 Zurich\nCP 80-135-1\nwww.swisslife.ch\nZurich, le 20 mars 2019\nConclusion de contrat police n° 105.527.194\nPersonne assurée: Bernadette Rondez\nService clientèle\nTéléphone 00800 873 873 00\nFax 00800 873 874 00\nprivate.service@swisslife.ch\n45PRK\nMadame,\nBienvenue et merci de faire confiance à Swiss Life.\nNous avons établi votre contrat comme vous le souhaitez.\nPour toute question, veuillez vous adresser à votre conseiller ou à notre Service clientèle.\nVeuillez agréer, Madame, nos salutations distinguées.\nSwiss Life\n11114\nUrs Schaffner\nResponsable Service Center\nTOM.\nPatrizia Ruchti\nResponsable Underwriting\nDocuments contractuels\nE014\n13413283.4/5/2-5/K1/....../145\n\n--- PAGE 2 ---\n\nSwiss Life SA, General-Guisan-Quai 40, Case postale, 8022 Zurich\nSwiss Life\nPolice n° 105.527.194 pour Bernadette Rondez\nSolution de prévoyance pilier 3a - prévoyance liée Swiss Life FlexSave Duo\nvalable dès le 5.3.2019\nVos données contractuelles personnelles de l'assurance vie\nPreneur d'assurance:\nPersonne assurée:\nDébut de l'assurance:\nDébut de chaque année\nd'assurance suivante:\nFin du contrat:\nMadame Bernadette Rondez\nMadame Bernadette Rondez, née le 6 janvier 1985\n5.3.2019\n5.3.\n5.3.2048\nVotre participation\nVotre solution de prévoyance participe à l'évolution de la valeur d'un Index-Basket. Cet Index-Basket\nregroupe divers grands indices d'actions mondiaux. Des informations concernant la composition de\nI'Index-Basket et le mode de fonctionnement de votre participation sont disponibles à l'adresse\nwww.swisslife.ch/flexsave.\nLe jour de référence pour le calcul des gains de participation est le 5.4. (jour de référence pour la\nparticipation).\nVous avez sélectionné l'option «Réinvestissement des gains de participation» avec laquelle la moitié des\ngains de participation, mais au plus 10% du capital-participation peuvent être utilisés pour le financement\nd'un capital-participation supplémentaire l'année suivante.\nPrestations\nCas de vie\nVersement minimum garanti au 5.3.2048\nLe versement minimum garanti peut augmenter via l'ajout de gains de participation et\nd'excédents. Les augmentations obtenues restent garanties.\nCHF\n118 423.00\nCas de décès\nVersement minimum garanti\nLes bénéficiaires perçoivent un versement garanti si la personne assurée décède\navant le 5.3.2048.\nCHF\n118 423.00\nLe versement minimum garanti peut augmenter via l'ajout de gains de participation et\nd'excédents versés. Les augmentations obtenues restent garanties.\nCas d'incapacité de gain\nExonération des primes en cas d'incapacité de gain après 3 mois de délai d'attente jusqu'au 4.3.2048.\nE630 STD\n13413283.4/5/3-5/K1/144\nPage 1\n\n--- PAGE 3 ---\n\nPolice n° 105.527.194\nVos primes\nAssurance en cas de vie et en cas de décès\nExonération du paiement des primes en cas d'incapacité de gain\nTotal annuel\nLa prime est due annuellement le 5.3.,\npour la première fois en 2019 et pour la dernière fois en 2047\nSwiss Life\nCHF\nCHF\n4 737.20\n288.80\nCHF\n5 026.00\nExplications relatives à vos primes\nUn rabais pour paiement des primes annuel est pris en compte dans les primes et prestations indiquées.\nExcédents\nLes excédents dépendent des revenus des capitaux générés chaque année ainsi que de l'évolution des\nrisques et des frais. Ils peuvent être soumis à d'importantes fluctuations. Les excédents ne sont pas\ngarantis. Les excédents pour assurances complémentaires sont accumulés et rémunérés.\nBases de calcul\nAssurance de capitaux (Composantes d'assurance avec début le 5.3.2019)\nTable de mortalité\nTaux d'intérêt technique\nSL 80%EKMF SVV86-90 (80% EKMF95)\n0.05%\nExonération des primes en cas d'incapacité de gain (Composantes d'assurance avec début le 5.3.2019)\nTable d'incapacité de gain\nTable de mortalité\nTaux d'intérêt technique\nSL IMF SL10-14\nSL 80%EKMF SVV86-90 (80%EKMF95)\n0%\nE630 STD\n13413283.4/5/4-5/K1/....../143.\nPage 2\n\n--- PAGE 4 ---\n\nSwiss Life\nPolice n° 105.527.194\nClause bénéficiaire\nEn cas de vie, le bénéfice de l'assurance est attribué au preneur d'assurance. En cas de décès, le bénéfice\nde l'assurance est attribué au conjoint survivant ou, dans le cadre d'un partenariat enregistré, au partenaire\nsurvivant, à défaut aux descendants directs ainsi qu'aux personnes physiques à l'entretien desquelles le\ndéfunt subvenait de façon substantielle, ou à la personne ayant formé une communauté de vie\nininterrompue avec le défunt durant les cinq années précédant le décès de celui-ci ou devant subvenir à\nl'entretien d'un ou de plusieurs enfants communs, à défaut aux parents, à défaut aux frères et soeurs, à\ndéfaut aux autres héritiers.\nZurich, le 20 mars 2019\nSwiss Life\n#1114\nUrs Schaffner\nResponsable Service Center\nTall\nPatrizia Ruchti\nResponsable Underwriting\nSi la teneur de la police ne concorde pas avec les conventions intervenues, le preneur d'assurance doit en demander la rectification dans les quatre\nsemaines à partir de la réception de l'acte, faute de quoi la teneur en est considérée comme acceptée (art. 12 LCA). S'il demande la réduction ou la\nsuppression de l'une des composantes de l'assurance, Swiss Life se réserve d'adapter les autres composantes à la nouvelle situation.\nSous réserve d'une attribution bénéficiaire, l'ayant droit à la prestation d'assurance et le preneur d'assurance.\nE630 STD\n13413283.4/5/5-5/K1/....../142\nPage 3"
}