{
  "filename": "police-axa.pdf",
  "company": "AXA",
  "policyNumber": "Assurance",
  "policyType": null,
  "insuredPerson": "Katia Monney\nChemin",
  "address": "2900 Porrentruy\nPas",
  "annualPremium": null,
  "startDate": "08.03.2023",
  "endDate": "31.03.2028",
  "franchise": null,
  "coverageType": "LCA",
  "rawText": "\n\n--- PAGE 1 ---\n\nPolice\nAssurance de ménage\nPolice n° 18.813.308\nAXA\nAssurance de la responsabilité civile privée\nAssurance de l'inventaire du ménage\nAssurances complémentaires et services\nPreneur d'assurance\nPersonnes coassurées\nDonnées générales du contrat\nRécapitulatif des primes\nMadame\nKatia Monney\nChemin des Tarrières 10\n2900 Porrentruy\nPas de personnes coassurées\nDébut\nFin\n08.03.2023\n31.03.2028\nPaiement\nAnnuel\nÉchéance de la prime annuelle\n01.04.\nResponsabilité civile privée\nCHF\n79.00\nInventaire du ménage\nCHF\n155.80\nAssurances complémentaires et services\nCHF\n31.20\nTaxes légales1\nCHF\n13.33\nPrime annuelle totale²\nCHF\n279.33\n1 Taxes légales\n- Droit de timbre 5%\n2 Rabais pris en compte (non pertinent pour les taxes légales)\n- Rabais pour contrat de longue durée 5%\npage 1/7\nAXA Assurances SA\nGeneral-Guisan-Strasse 40, Case postale 357\n8401 Winterthur\nAXA.ch\nD4BF1621-5B00-410A-96C4-15E5B63ED688 OMS1428\n\n--- PAGE 2 ---\n\nAssurance de ménage\nPolice n° 18.813.308\nAXA\nResponsabilité civile privée\nCouverture de base Responsabilité civile privée\nSont assurés les dommages causés involontairement\nà des personnes ou à des choses appartenant à des\ntiers.\nConditions de logement: Location\n✓ Assuré\n* Non assuré\nUtilisation de véhicules privés appartenant à des tiers\nSont assurés les dommages découlant de l'utilisation de\nvéhicules automobiles privés empruntés gratuitement à\ndes amis ou à des connaissances par exemple.\nUtilisation de véhicules de location et en autopartage\nSont assurés les dommages découlant de l'utilisation de\nvéhicules automobiles contre rémunération ou de\nvéhicules mis à disposition par une association ou par\nl'employeur en vue d'un usage privé.\nSont assurés en sus les dommages causés à ces\nvéhicules automobiles.\nDommages causés par des animaux domestiques\naux logements locatifs\nSont assurés les dommages causés à un logement\nlocatif par des animaux domestiques.\nChasseurs\nSont assurés les dommages causés lors d'une partie de\nchasse à d'autres personnes ou à des choses\nappartenant à des tiers.\nLocataires de chevaux\nSont assurés les dommages causés involontairement à\nun cheval pris en location.\nSomme d'assu-\nrance en CHF\nFranchise\nPrime\nen CHF\nnette\n79.00\n5'000'000\n200\nRécapitulatif de la prime Responsabilité civile privée\nCHF\n79.00\npage 2/7\nAXA Assurances SA\nD4BF1621-5B00-410A-96C4-15E5B63ED688 OMS 1428\n\n--- PAGE 3 ---\n\nAssurance de ménage\nPolice n° 18.813.308\nAXA\nLogement\n3.5\nInventaire du ménage\nSite A: Chemin des Tarrières 10, 2900 Porrentruy\nType de bâtiment:\nNombre de pièces:\nType de construction:\nUsage:\nMaçonnerie / béton\nHabité en permanence\nConditions de logement:\nLocation\nRez de chaussée:\nNon\n✓ Assuré\n* Non assuré\nSomme d'assu-\nrance en CHF\nFranchise\nPrime\nen CHF\nnette\n59.40\n21'200\n200\nCouverture de base COMFORT\nL'inventaire du ménage est assuré contre l'incendie,\nle vol et les dégâts d'eau. Sont assurés dans le cadre\nde la somme d'assurance:\n■ bijoux jusqu'à 30 000 CHF\n■ valeurs pécuniaires jusqu'à 5000 CHF\n■ les frais (p. ex. frais de déblaiement, serrures\nprovisoires, etc.) jusqu'à concurrence de 20% de la\nsomme d'assurance\n■ les objets à usage professionnel sont assurés en\nsus jusqu'à 20 000 CHF\nAssurance contre les dommages dus aux événements\nnaturels (p. ex. tempête, grêle, etc.).\nPart de prime légale: 4.50 CHF\nAdaptation annuelle autom. de la somme d'ass.\nVol hors du domicile\nSont assurés les vols simples lors de déplacements (p.\nex. vol à la tire et vol par ruse).\nBris d'éléments en verre ou en pierre dans les\nmeubles\nEst assuré le bris de vitrages de meubles (p. ex.\nvitrine).\nBris de fenêtres, de lavabos et de vitrages\ndu bâtiment\nEst assuré le bris de fenêtres, lavabos, toilettes,\nbaignoires, etc.\nConstructions en plein air\nSont assurées les choses installées de manière fixe\nautour de la maison (murs de soutènement, etc.).\nTremblement de terre\nEst assuré l'inventaire du ménage détérioré ou détruit à la\nsuite d'un tremblement de terre.\npage 3/7\nAXA Assurances SA\n500\n14.00\n2'000\n0\n47.30\n2'000\n0\nD4BF1621-5B00-410A-96C4-15E5B63ED688 OMS1428\n\n--- PAGE 4 ---\n\nAssurance de ménage\nPolice n° 18.813.308\nAXA\nProtection complète de l'inventaire du ménage - couverture élargie pour les\nprincipaux objets\nCette couverture complète assure les principaux objets de l'inventaire du ménage contre l'endommagement et la\ndestruction résultant de l'action de forces extérieures, ainsi que contre la perte et le vol.\nSmartphones, tablettes et appareils\nélectroniques de loisirs\nSont p. ex. assurés les ordinateurs portables, les\ntéléviseurs et les consoles de jeux endommagés ou\nvolés.\nVélos, vélos électriques et équipements de sport\nSont p. ex. assurés les mobylettes, les skis et les\nsnowboards endommagés ou volés.\nLunettes, appareils auditifs et moyens auxiliaires\nmédicaux\nSont p. ex. assurés les fauteuils roulants, les véhicules\npour seniors et les déambulateurs endommagés ou\nvolés.\nLes prestations sont prises en charge en complément\n(couverture subsidiaire) de celles versées par d'autres\nassurances telles que l'AVS, l'Al, la caisse-maladie ou\nl'assurance-accidents.\nBagages\nSont assurés les bagages, notamment lorsqu'ils sont\nendommagés ou volés lors d'un voyage en avion.\nBijoux, montres et instruments de musique\nSont p. ex. assurés les bagues, les colliers et les violons\nendommagés ou volés.\nArt, collections et antiquités\nSont assurés les objets d'art, les collections et les\nantiquités lorsqu'ils sont endommagés ou volés.\nRécapitulatif de la prime Inventaire du ménage\npage 4/7\nAXA Assurances SA\n✓ Assuré\n* Non assuré\nSomme d'assu-\nrance en CHF\nFranchise\nen CHF\nPrime\nnette\n1'000\n200\nCHF\n155.80\n35.10\nD4BF1621-5B00-410A-96C4-15E5B63ED688 OMS 1428\n\n--- PAGE 5 ---\n\npage 5/7\nAssurance de ménage\nPolice n° 18.813.308\nAXA\nAssurances complémentaires et services\nFaute grave\nAXA renonce à réduire les prestations en cas de\ndommage imputable à une faute grave causé à\nl'inventaire du ménage ou relevant de la responsabilité\ncivile privée (p. ex. bougie non surveillée qui déclenche\nun incendie).\nPerte de clés et service de serrurerie\nSont assurés les frais induits par le service de\nserrurerie et le remplacement de clés, y compris les\nfrais relatifs à un changement de serrures nécessaire\n(p. ex. frais générés en cas de perte de clés du\nlogement locatif, qui oblige à changer les serrures).\nService d'intervention d'artisan en urgence\nDans les cas d'urgence suivants liés au logement, AXA\nfait intervenir un artisan: débouchage de conduites,\nproblèmes avec des installations sanitaires, électriques\nou de chauffage, élimination de nids de guêpes,\nd'abeilles et de frelons, lutte contre les parasites.\nSont assurés au maximum deux sinistres par an.\nAssistance vélo et vélo électrique\nAXA organise le dépannage et le remorquage vers un\natelier de réparation de vélos et de vélos électriques. Sont\négalement couverts les frais de transport pour le retour\nau domicile ou la poursuite du voyage, ainsi que les frais\nd'hébergement et de restauration.\nSont assurés au maximum deux sinistres par an.\n✓ Assuré\nSomme d'assu-\nFranchise\nPrime\n* Non assuré\nrance en CHF\nen CHF\nnette\n16.50\n14.70\n10'000\n200\nRécapitulatif de la prime Assurances complémentaires et services\nCHF\n31.20\nAXA Assurances SA\nD4BF1621-5B00-410A-96C4-15E5B63ED688 OMS1428\n\n--- PAGE 6 ---\n\nAssurance de ménage\nPolice n° 18.813.308\nAXA\nBases contractuelles\nConditions générales d'assurance (CGA)\nSont déterminantes les conditions générales (CGA) de l'assurance de ménage, édition 10.2021.\nwww.axa.ch/doc/ag6aa\nDes modifications tarifaires visées dans les CGA demeurent réservées.\nConditions particulières d'assurance (CPA)\nEn complément ou en dérogation aux Conditions générales d'assurance (CGA) précitées, les Conditions particulières\nd'assurance (CPA) ci-après s'appliquent.\nInformations complémentaires\nRabais pour contrat de longue\ndurée\nAutres personnes coassurées\nDroit de timbre\nLe rabais pour contrat de longue durée est valable pendant toute la durée du\ncontrat définie dans la police. Si le contrat n'est pas prolongé, ce rabais cesse\nd'être accordé à l'expiration du contrat.\nLes autres personnes assurées sont assujetties au paiement d'une prime à\ncompter de leur 18e anniversaire. Un supplément de prime s'applique à\nl'échéance principale du contrat.\nTaxe légale: 5% de la prime nette\nIl n'existe aucun droit de résiliation en cas de modification des primes due à des conditions préférentielles, rabais, à des\ntaxes légales ou à d'autres personnes assurées (cf. point A10.4 CGA).\npage 6/7\nAXA Assurances SA\nD4BF1621-5B00-410A-96C4-15E5B63ED688 OMS1428\n\n--- PAGE 7 ---\n\nAssurance de ménage\nPolice n° 18.813.308\nWinterthur, 9 mars 2023\nAXA Assurances SA\nd.beans\nAXA\nm.\nEar\nDominique Kasper\nResponsable Assurance Dommages\nMartin Schmid\nResponsable Particuliers\npage 7/7\nAXA Assurances SA\nD4BF1621-5B00-410A-96C4-15E5B63ED688 OMS1428"
}