{
  "filename": "police-groupemutuel-ijm.pdf",
  "company": "Groupe Mutuel",
  "policyNumber": "d",
  "policyType": null,
  "insuredPerson": "est de CHF",
  "address": "8989 Une",
  "annualPremium": null,
  "startDate": "01.11.2023",
  "endDate": "31.12.2026",
  "franchise": null,
  "coverageType": "LAMal",
  "rawText": "\n\n--- PAGE 1 ---\n\ngroupemutuel\nVotre partenaire\npour les assurances\nde l'entreprise\nContrat d'assurance\nSwissoil Trading SA\nIJM\nIndemnité journalière selon LAMal\nLAA\nAssurance-accidents selon LAA\nLAAC\nAssurance complémentaire à la LAA\nLPP\nPrévoyance professionnelle\nCPL\nAssurance Santé & Patrimoine\nN° 2208989\nUne société de Groupe Mutuel Holding SA\nAvenir Assurance Maladie SA\nRue des Cèdres 5, CH-1919 Martigny\nwww.groupemutuel.ch\n\n--- PAGE 2 ---\n\ngroupemutuel\nGénéralités\nAssureur\nAvenir Assurance Maladie SA\nRue des Cèdres 5, 1920 Martigny\nN° IDE 101.473.324\nTél. 0848 803 777, Fax 0848 803 112\nPreneur d'assurance\nSwissoil Trading SA\nRue Pierre-Fatio 15\n1204 Genève\nRenseignements sur l'entreprise\nGenre d'entreprise\nNuméro IDE\n467100\nCommerce de gros de combustibles et de produits\nannexes\nCHE-104.851.121\nDébut et échéance du contrat d'assurance\nDébut du contrat\nEchéance du contrat\nUne société de Groupe Mutuel Holding SA\nAvenir Assurance Maladie SA\nRue des Cèdres 5, CH-1919 Martigny\nwww.groupemutuel.ch\n01.11.2023\n31.12.2026\n2/5\n10.11.2023/C-123.05423\n\n--- PAGE 3 ---\n\ngroupemutuel\nCouverture et prime d'assurance\nPersonnes assurées\nTout le personnel\nCouverture d'assurance\nL'assurance couvre les conséquences économiques d'une incapacité de travail/de gain. Le salaire annuel\nmaximal assuré est de CHF 250'000 par personne.\nTout le personnel (à titre obligatoire en fonction du salaire)\nMasse\nsalariale en CHF\nTaux\nen %\nPrime annuelle\nprovisoire en CHF\nMaladie\nDurée des prestations 730 jours\ndans une période de 900 jours consécutifs\npour une ou plusieurs incapacités\nAvec imputation du délai d'attente\nDélai d'attente par incapacité\n80% du salaire, délai d'attente 30 jours\n148'200 1.16\n1'719.00\nPrime nette maladie\nMaternité\nDurée des prestations 112 jours\nPrime nette totale\nsous déduction des prestations LAMat GE,\n80% du salaire\n*Le taux maternité est inclus dans celui de la maladie\nTotal assurance indemnité journalière\n1'719.00\n1'719.00\n1'719.00\nUne société de Groupe Mutuel Holding SA\nAvenir Assurance Maladie SA\nRue des Cèdres 5, CH-1919 Martigny\nwww.groupemutuel.ch\n3/5\n10.11.2023/C-123.05423\n\n--- PAGE 4 ---\n\ngroupemutuel\nDispositions contractuelles\nMode de paiement de la prime provisoire\nPayable\nEchéance principale de la prime provisoire annuelle\nDébiteur des primes\nAnnuellement\n1er janvier\nLe preneur d'assurance\nLa prime minimale par année civile est fixée à CHF 200 pour l'assurance indemnité journalière en cas de\nmaladie.\nVersement des prestations\nAu preneur d'assurance\nCP0228.01 Sans reprise des cas en cours\nLes cas d'incapacité de travail débutant avant l'entrée en vigueur du contrat ne sont pas repris par l'assureur.\nCP0267.02 Garantie du taux\nLes taux de prime sont garantis jusqu'au 31.12.2026. A l'échéance de cette période, l'art. 20 al. 1 des\nConditions générales d'assurance BE s'applique.\n4/5\nUne société de Groupe Mutuel Holding SA\nAvenir Assurance Maladie SA\nRue des Cèdres 5, CH-1919 Martigny\nwww.groupemutuel.ch\n10.11.2023/C-123.05423\n\n--- PAGE 5 ---\n\ngroupemutuel\nDispositions finales\nParties intégrantes\nConditions générales de l'assurance collective d'une indemnité journalière selon la LAMal, édition\n01.01.2018/BEGM03\nLe preneur d'assurance déclare avoir pris connaissance du présent contrat, des conditions générales et\nparticulières de l'assureur. Il en accepte le contenu sous leur forme actuelle ainsi que les modifications\nultérieures qui pourraient y être apportées et qui découlent d'une obligation fédérale ou cantonale.\nMartigny, le 14 novembre 2023\nAvenir Assurance Maladie SA\nUne société de Groupe Mutuel Holding SA\nAvenir Assurance Maladie SA\nRue des Cèdres 5, CH-1919 Martigny\nwww.groupemutuel.ch\nVincent Claivaz\nBetrisey\nDidier Betrisey\nResponsable Santé & Prévoyance -\nClients Entreprise\nResponsable Contrats\nEntreprise\n5/5\n10.11.2023/C-123.05423"
}