{
  "filename": "police-simpego-vehicule.pdf",
  "company": "SIMPEGO",
  "policyNumber": "d",
  "policyType": null,
  "insuredPerson": "David Da Silva Antonio",
  "address": "2025 Car Assurance",
  "annualPremium": null,
  "startDate": "30.05.2025",
  "endDate": "17.04.1973",
  "franchise": null,
  "coverageType": "IJM",
  "rawText": "\n\n--- PAGE 1 ---\n\nsimpego\nservice@simpego.ch\nwww.simpego.ch\nVotre conseiller :\nWW Finance Group Sàrl\nSimpego Service Center\n+41 58 521 11 11\nservice@simpego.ch\nZurich, 30.05.2025\nCar Assurance véhicule - Police d'assurance CAR71239\nDonnées personnelles\nPreneur d'assurance\nAdresse\nEmail\nDate de naissance\nPermis de conduire\nNationalité/Permis de séjour\nConducteur de moins de 25 ans\nLe détenteur du véhicule est le\nconducteur principal\nContenu du contrat\nNuméro de contrat\nNuméro de version\nMonsieur David Da Silva Antonio\nCH-2952 Cornol, Rue du Breuil 2\ncontact@winwin.swiss\n17.04.1973\n1992\nPortugal B-Permis de séjour\nNon\nOui\nDébut du contrat\nEchéance du contrat\nFréquence de paiement\nMode de paiement\nDroit de résiliation journalier\nDépôt de plaque (suspension)\nAperçu des primes\nCAR71239\n1675156\n09.07.2025\n08.07.2026\nsemestriel\nfacture\nNon\nAvec remboursement de prime\nPrime annuelle\nSont inclus dans ce prix:\nTaxes légales\nPaiement semestriel\nSimpego Assurances SA, Hohlstrasse 556, 8048 Zurich\nCHF 1'439.20\nCHF 72.80\nCHF 719.60\nPage 1 à 4\nD\nEX\n\n--- PAGE 2 ---\n\nsimpego\nservice@simpego.ch\nwww.simpego.ch\nDonnées du véhicule\nPlaque d'immatriculation\nMarque et type\n1. er mise en circulation\nNuméro de matricule\nAnnée d'acquisition, d'achat\nPrix catalogue\nEquipements et accessoires\nJU 45262\nPeugeot 308 1.6 THP GT\n2015\n301681446\n2015\nCHF 37'700.00\nillimitées\nLeasing\nUtilisation pour les voyages d'affaires\nNon\nNon\nUtilisation pour le transport commercial, le transport Non\ncommercial de marchandises et de passagers\nSimpego Assurances SA, Hohlstrasse 556, 8048 Zurich\nPage 2 à 4\nD\nEX\n\n--- PAGE 3 ---\n\nsimpego\nservice@simpego.ch\nwww.simpego.ch\nCouverture d'assurance (tous les véhicules assurés)\nResponsabilité civile\nSomme d'assurance\nFranchise pour tous les conducteurs\nFranchise supplémentaire pour les conducteurs non\ndéclarés de moins de 25 ans\nCHF 100'000'000\nCHF O\nCHF 1'000\nAssurance casco\nCasco partielle\nFranchise casco partielle\nCasco collision\nassuré\nCHF 0\nassuré\nFranchise casco collision\nFranchise supplémentaire casco collision pour les\nconducteurs non déclarés de moins de 25 ans\nDommages au véhicule parqué\nFranchise pour dommages au véhicule parqué\nBris de glace Plus\nObjets personnels emportés\nConvention de réparation\nCHF 1'000\nCHF O\nPlus\nCHF O\nassuré\npas assuré\nLibre choix du garage\nAssurance-accidents\nCercle des personnes assurées\nPrestations par personne:\nIndemnité journalière\nEn cas d'invalidité\nEn cas de décès\nFrais de guérison\nAssurance pour faute grave\nAssistance 24h/24\nD\nEX\nCHF 337.40\nCHF 835.60\nCHF 44.60\ntous les occupants\nCHF 25\nCHF 60'000\nCHF 30'000\nassuré\nassuré\nPlus\nCHF 29.00\nCHF 119.80\nSimpego Assurances SA, Hohlstrasse 556, 8048 Zurich\nPage 3 à 4\n\n--- PAGE 4 ---\n\nsimpego\nservice@simpego.ch\nwww.simpego.ch\nD\nEX\nBases contractuelles pour l'assurance véhicule\nFiche d'information sur le produit, édition Juillet 2024\nConditions générales d'assurance (CGA), édition Mars 2023\nVous trouverez les conditions d'assurance de votre produit à l'adresse www.simpego.ch.\nSimpego Assurances SA\nSimpego Assurances SA, Hohlstrasse 556, 8048 Zurich\nPage 4 à 4"
}