{
  "filename": "police-swica-lamal-lca.pdf",
  "company": "SWICA",
  "policyNumber": "D",
  "policyType": null,
  "insuredPerson": "Nils Golay\nRue",
  "address": "1006 Lausanne",
  "annualPremium": null,
  "startDate": "16.10.2025",
  "endDate": "12.08.1999",
  "franchise": null,
  "coverageType": "LAMal",
  "rawText": "\n\n--- PAGE 1 ---\n\nSWICA ORGANISATION DE SANTÉ\nRÉGION SUISSE ROMANDE, SITE LAUSANNE\nBoulevard de Grancy 39/1006 Lausanne /swica.ch\nLÀ POUR VOUS.\nlausanne@swica.ch\nTéléphone +41 21 619 48 48\nLausanne, 16.10.2025\nVOTRE NOUVELLE POLICE D'ASSURANCE\nMonsieur\nNils Golay\nRue de la Gare 15C\n1110 Morges\nSWICA\n8283042/5099\nMonsieur,\nVous recevez ci-joint votre nouvelle police d'assurance confirmant votre couverture d'assurance. Si vous\ndésirez avoir toutes les informations importantes à portée de main, nous vous conseillons de placer cette police\navec les autres documents relatifs à l'assurance-maladie.\nLes collaborateurs de votre succursale sont bien sûr à votre entière disposition pour toute question ou demande\nconcernant votre couverture d'assurance.\nNombre d'informations, conseils et documents complémentaires utiles sont également disponibles en ligne à\nl'adresse www.swica.ch.\nEn vous remerciant de votre confiance, nous vous prions d'agréer, chère cliente, cher client, nos salutations\ndistinguées.\nVeuillez recevoir nos salutations les meilleures.\nSWICA Organisation de santé\nПиший\nDr. Reto Dahinden\nDirecteur général\n1/1\n\n--- PAGE 2 ---\n\nSWICA ORGANISATION DE SANTÉ\nRÉGION SUISSE ROMANDE, SITE LAUSANNE\nBoulevard de Grancy 39/1006 Lausanne /swica.ch\nLÀ POUR VOUS.\nlausanne@swica.ch\nTéléphone +41 21 619 48 48\nNILS GOLAY\nDATE DE NAISSANCE 12.08.1999\nN° ASSURANCE 8283042\nMonsieur\nNils Golay\nRue de la Gare 15C\n1110 Morges\nLausanne, 16.10.2025\nPOLICE D'ASSURANCE\nVALABLE DÈS LE 09.09.2025\nSWICA\n8283042/5099\nContrat collectif 1541106 BENEVITA\nBENEVITA - Remise sur les primes - Niveau 2\nAssurances selon la loi sur l'assurance-maladie (LAMAL)\nAssurance de base FAVORIT MEDPHARM\nVous prémunit contre les frais engendrés par des traitements ambulatoires ou des\nséjours hospitaliers dans la division commune d'un hôpital conventionné sis dans votre\ncanton de domicile. Le premier interlocuteur auquel vous adresser pour toute question\nmédicale ainsi que préalablement à tout recours aux services d'une ou d'un médecin ou\nd'un hôpital est une pharmacie partenaire de SWICA ou le service de conseil santé par\ntéléphone santé24. Vous choisissez une ou un médecin dans le répertoire MEDPHARM\nen vigueur.\n- Votre franchise annuelle s'élève à CHF 2 500.-\n- Votre quote-part monte à 10 %\n- Risque accidents non assuré\n- Région prime Vaud 1\n- CGA 2024 / CS 2025\nAssureur responsable: SWICA Assurance-maladie SA, 8400 Winterthour\nLa contribution légale de CHF 4.80 par an à la fondation Promotion Santé Suisse est\ncomprise dans la prime.\nRedistribution du produit de la taxe environnementale à la population\nPrime mensuelle CHF\n408.60\n-5.15\n1/2\n\n--- PAGE 3 ---\n\nNils Golay, 12.08.1999\nSubvention cantonale: La prime de votre assurance obligatoire des soins ne tient pas compte de la\nsubvention cantonale. En cas de droit à une subvention, le crédit sera pris en considération dans votre\ndécompte de prime.\nTotal par mois\nPaiement mensuel\nPrime mensuelle CHF\n403.45\n403.45\n2/2"
}